"","15","053","1","4","7","Furnizimi me material hidro-sanita,bravari dhe vegla pune","22.07.2015","","958.98","","NTP ""A&L"""," ","","",""
"","15","054","1","4","7","Furnizimi me sirena alarmuese dhe konventor per BPZ","22.07.2015","","980","","NT Auto Dekor ""Buli"""," ","","",""
"","15","055","2","4","7","Shërbimet e sigurimit të objekteve të QPS përmes sistemit të alarmit","29.07.2015","","960","","SHP ""Delta Security"""," ","","",""
"","15","058","1","4","7","Furnizimi me karrika dhe tavolina për SHME ""Gjin Gazulli""- Prishtinë","02.09.2015","","998","","NPT ""MALI-I"""," ","","",""
"","15","059","1","4","7","Furnizimi me artikuj higjenik për nxënësit e komunitetit RAE","18.09.2015","","843.74","","NPT""Bajraktari Com"""," ","","",""
"","15","060","1","4","7","Dizanji i kampanjës dhe materialit promocional","21.09.2015","","973.5","","SHPK ""PR Solutions"""," ","","",""
"","15","061","1","4","7","Furniz.i materialit për pun. e bazamentit në shtyllat e bet. në rr. Siqevë-Llukar(0.4kv)","02.10.2015","","993.3","","NNTSH ""Drini"" "," ","","",""
"","15","062","2","4","7","Pastrimi gjeneral ne ish ndërtesën e Gjykatës se Apelit ne Prishtinë","02.10.2015","","300","","SHPK ""M.S.S."""," ","","",""
"","15","063","1","4","7","Furnizimi me paisje elektronike - të rrjetit","07.10.2015","","398","","OK ""Comtrade Compu.  Prishtinë"," ","","",""
"","15","064","1","4","7","Furnizimi me vaj motori (15w-40) për automjetet e BPZ-së","07.10.2015","","721.76","","SHPK""Euro Delta"""," ","","",""
"","15","065","1","4","7","Furnizimi me paisje elektrike-elektronike për Drejtoratin e Inspekcionit","12.10.2015","","370.6","","ASWO""El.Kosova"""," ","","",""
"","15","066","1","4","7","Furnizimi me tavolina dhe karriga për DKA","15.10.2015","","600.73","","""Lesna Ing.AF'"," ","","",""
"","15","067","1","4","7","Furnizimi me paisje elektrike","15.10.2015","","935.55","","NTP""Pajta"""," ","","",""
"","15","068","2","4","7","Rregullimi i terrenit - shtrurja e kubzave nga betoni, grryerja dhe largimi i dheut","29.10.2015","","588","","NNT ""Brezi Kufitar"""," ","","",""
"","15","069","1","4","7","Furnizimi dhe montimi i foljeve në 3 autovetura të Komunës","29.10.2015","","270","","DPZ ""Xhema"""," ","","",""
"","15","070","1","4","7","Furnizimi me kartela me çip për printim","09.11.2015","","962.5","","LLC ""Profesional Alarm"," ","","",""
"","15","071","1","4","7","Furnizimi me flipcharta (tabela) me elemente përcjellëse","09.11.2015","","252","","NTGI""Grafo Loni"""," ","","",""
"","15","072","2","4","7","Rekonstruimi i nyjeve sanitare ne Gjimnazin Sami Frashëri - Prishtinë","09.11.2015","","964","","NTP ""Ulpiana"""," ","","",""
"","15","073","1","4","7","Furnizimi me material për bife në Drejtoratin e Inspekcionit","09.11.2015","","226.64","","SHPK ""Al-Trade"" "," ","","",""
"","15","074","2","4","7","Furnizimi dhe montimi i derës me kornizë nga alumini","25.11.2015","","380","","""Metra- Construction"""," ","","",""
"","15","075","1","4","7","Furnizimi me dhurata për fëmijët e komunitetit RAE","26.11.2015","","993.6","","""Maxi-Hipermarket"," ","","",""
"","15","076","2","4","7","Transporti i 35 pasagjerëve në relacionin Prishtinë-Prevallë -Prizren dhe anasjelltas","26.11.2015","","400","","""Sharr Travell"""," ","","",""
"","15","077","2","4","7","Instalimi i sistemit të Access controllës","26.11.2015","","980","","SHPK""Pro-4"""," ","","",""
"","15","078","2","4","7","Rregullimi i mobileve në kujdestarinë e objektit te BPZ-së","30.11.2015","","995","","SHPK""Modako"""," ","","",""
"","15","079","2","4","7","Instalimi i telefonisë fikse ne Sek.e Legalizimit ne Komunën e Re- Arbëri","04.12.2015","","450","","""Telecomm Service"""," ","","",""
"","15","080","1","4","7","Furnizimi me kupa dhe kupona me vlerë - shpërblime për Laureatët e sportit","04.12.2015","","985","","""Sporting"""," ","","",""
"","15","081","1","4","7","Furnizimi dhe montimi i DVR-it në Gjimnazin ""Sami Frashëri - Prishtinë","15.12.2015","","979","","SHPK ""Delta Security"""," ","","",""
"","15","082","1","4","7","Furnilzimi dhe montimi i paisjeve të IT-së në Drejtoratiln e Kadastrit ","16.12.2015","","466.1","","SHPK GeoTECH"" "," ","","",""
