1+2,234,2,3,6,55,Organizimi I sherbimeve hoteliere per festat e fund vitit dhe tjera,09.12.10,"10,000.00","10,000.00",,Rest. Prishtina,Prishtinë,1,1,1
1+2,235,2,2,1,93,Dekorimi me drita ne qytetin e Prishtines,20.12.10,"60,000.00","58,000.00",,Link M.Plus,Prishtinë,1,2,1
1+2,238,5,2,5,45,Punet shtesë ne ndertimin e shkolles se gjelbert,08.12.10,"13,756.00",,"13,756.38",Izolimi&Al Tra,Prishtië,1,1,1
1+2,240,5,3,6,45,Riparimi I kanalizimit atmosferik ne rrugen Haxhi Zeka,14.01.11,"9,460.00",,"9,460.00",Dardania,Prishtinë,1,1,1
1+2,241,2,3,6,92,"Shpallja e sportistit te vitit dhe organizimi I turneut te shahut ""H. Talla""",24.12.10,"9,500.00","9,370.00",,Klubi I shahut,Prishtinë,1,1,1
1+2,242,5,3,5,45,Punet shtesë ne renovimin e salles se Kuvendit Komunal,28.12.10,"8,220.77",,"8,220.77",Union Enterier,Prishtinë,1,1,1
1+2,243,2,3,6,92,Pergaditjet teknike per organizimin e Vitit te Ri,28.12.10,"10,000.00","9,765.00",,Mink Producti,Prishtinë,1,1,1
1+2,244,2,3,6,92,Organizimi i programit per Vitin e Ri,28.12.10,"10,000.00","8,850.00",,De Production,Prishtinë,1,1,1
1,1,1,4,7,,Sigurimi i ushqimit për trajnimin e drejtorëve të shkollave,08.01.10,,409.5,,"""Beni Dona""",Prishtinë,1,1,1
1,2,1,4,7,,Furnizimi me gypa Pastor-Premium F-52x220,22.01.10,,950,,"""Pastor Kosova""",Prishtinë,1,1,1
1,4,2,4,7,,"Servisimi , mirmbajtja e centralit dhe rrjetit telefonik për vitin 2010",25.01.10,,995,,NTP '' Eltrisi'',Prishtinë,1,1,1
1,5,1,4,7,,"Furnizimi me rollne për faks, pllafonierka, telefona etj.",01.02.10,,910,,"NT ""Adria 7""",Prishtinë,1,1,1
1,6,1,4,7,,Furnizimi me stufë termoakumuluese,03.02.10,,325,,"NTP ""Forca""",Prishtinë,1,1,1
1,7,1,4,7,,Furnizimi me uniforma,05.02.10,,759.2,,"""Mini-Max""",Prishtinë,1,1,1
1,8,1,4,7,,Furnizimi dhe servisimi me paisje teknike,25.02.10,,635,,"""ProfesionalAlarm""",Prishtinë,1,1,1
1,9,1,4,7,,Furnizimi me telefon mobil NOKIA E-72,25.02.10,,300,,"Mobi shop""Te Gajtani""",Prishtinë,1,1,1
1,10,2,4,7,,Servisimi i risografit 1510,25.02.10,,220.4,,"""FotoColor-Studio""",Prishtinë,1,1,1
1,11,1,4,7,,"Furnizimi me material biblotekar, libreza, kartela, etiketa etj.",02.03.10,,995,,"""K.G.T.""",Prishtinë,1,1,1
1,12,1,4,7,,Furnizimi me paisje për kamera,17.03.10,,618,,"""Meteori""",Prishtinë,1,1,1
1,13,1,4,7,,Furnizimi me montim i mbrojtësit të veturës RENO Megane,17.03.10,,397.88,,"""Renault Centre""",Prishtinë,1,1,1
1,14,2,4,7,,Servisimi i automjetit special Mercedes BENZ për Brigadën e Zjarrëfikësve,12.04.10,,890,,"""AutoServis-Sistem",Obiliq,1,1,1
1,15,1,4,7,,"Furnizimi me material higjenik për Biblotekën Ndërkomunale ""H.Sylejmani""",15.04.10,,592.5,,"""K.G.T.""",Prishtinë,1,1,1
1,16,1,4,7,,Furnizimi me vula te reja për Komune,19.04.10,,255,,"Vulep.""Toni""",Prishtinë,1,1,1
1,17,1,4,7,,Furnizimi dhe montimi i folies MAT,03.05.10,,720,,"""K.G.T.""",Prishtinë,1,1,1
1,18,1,4,7,,Furnizimi me uniforma për punëtorë teknik,11.05.10,,840,,"""Mini-Max""",Prishtinë,1,1,1
1,19,1,4,7,,Furnizimi me hyjnesha në fron,14.05.10,,595,,"""Beauty""",Prishtinë,1,1,1
1,20,1,4,7,,"Furnizimi me ushqim për ""Garat e Diturisë""",24.05.10,,746.2,,"""Beni-Dona""",Prishtinë,1,1,1
1,21,1,4,7,,"Riparime ne SHMEJ ""Hoxhë Kadri Prishtina""",01.06.10,,897,,"NN ""Extra-Besi""",Prishtinë,1,1,1
1,22,1,4,7,,Furnizimi me bateri për automjete,28.05.10,,896.4,,"""Eurogoma""",Prishtinë,1,1,1
1,23,1,4,7,,"Furnizimi me ushqim dhe ujë për ""Testin e Maturës""",07.06.10,,974.96,,"""Beni Dona""",Prishtinë,1,1,1
1,24,1,4,7,,Furnizimi me material për riparime,07.06.10,,869,,"""A*L""",Prishtinë,1,1,1
1,25,1,4,7,,Furnizimi me telefona Panasonic,10.06.10,,960,,"""Adria 7""",Prishtinë,1,1,1
1,26,1,4,7,,"Furnizimi me ujë të pijes për ""Tekstin e Arritshmërisë së nxënësve""",29.06.10,,570,,"""Beni Dona""",Prishtinë,1,1,1
1,27,2,4,7,,Instalimi i lilldhjeve telefonike në objektin e ri - Arbëri,29.06.10,,777,,"""Neon-Ex""",Prishtinë,1,1,1
1,28,2,4,7,,Fotokopjimi i dokumentacionit të kadastrit për Graçanicë,29.06.10,,970,,"""Richon""",Prishtinë,1,1,1
1,29,2,4,7,,Servisimi - rregullimi i presës për lidhjen e barit,01.07.10,,659,,"AS ""Xhati""",Prishtinë,1,1,1
1,30,1,4,7,,Furnizimi me strajca shpine V-25 për fikjen e zjarrit,23.08.10,,915,,"""Pastor Kosova""",Prishtinë,1,1,1
1,31,1,4,7,,"Furnizimi me material elektrik dhe paaisje tjera në obj. banesor afar.""K. e Diellit""",07.09.10,,952,,"""Ariani-Commerc""",Prishtinë,1,1,1
1,32,1,4,7,,Furnizimi me hidrofor për sh.f. në Mramuer,07.09.10,,305,,"NTP""Dinga""",Prishtinë,1,1,1
1,33,1,4,7,,Transporti i nxënësve Tenezhdoll-Vranidoll,07.09.10,,980,,"NT ""Hani Trans""",Prishtinë,1,1,1
1,34,1,4,7,,Furnizimi me kasaforta për vula dhe dokumentacion,30.09.10,,990,,"""Protec""",Prishtinë,1,1,1
1,35,1,4,7,,Furnilzimi me bateri (akumulatorë) për Briogadën e Zjarrëfikësve,29.09.10,,939.6,,"""Eurogoma""",Prishtinë,1,1,1
1,36,2,4,7,,Modifikimi i aplikac. Softuerik për Drejtorinë e Ekonomisë dhe Zhvillimit,04.10.10,,696,,"""Ati-Kos""",Gjakovë,1,1,1
1,37,1,4,7,,"Furnizimi me rezervoar te ujit 1500 lit. dhe hidrofor për sh.f. ""Nazim Gafurri""",04.10.10,,995,,"""Good Trade""",Prishtinë,1,1,1
1,38,2,4,7,,"Shërbimet e zërimit, montimi dhe përkthimi simultan",11.10.10,,950,,"NTSH ""Toni""",Prishtinë,1,1,1
1,39,1,4,7,,Furnizimi me hyjnesha në fron,11.10.10,,735,,"""Beauty""",Prishtinë,1,1,1
1,40,1,4,7,,Furnizimi me material për rrethojë,14.10.10,,975,,"""Reka Commerc",Prishtinë,1,1,1
1,41,1,4,7,,Furnizimi me material për rregullimin e zyrave,21.10.10,,965,,"""Extra Besi""",Prishtinë,1,1,1
1,42,1,4,7,,Furnizimi me mallra për Bife të Komunës,19.10.10,,531.7,,"""Kulinareks""",Prishtinë,1,1,1
1,43,1,4,7,,"Furnizimi me ujë të pijes pa gas 0,5 lit.",21.10.10,,313.04,,"""Beni Dona""",Prishtinë,1,1,1