2,217,5,2,1,45,"Ndertimi I mureve mbrojtese ne rruget Tomori, Tutini dhe kanal. Ne Suteskë",06.12.11,"135,000.00","126,365.20",,ABC&Euro Engji,Podujevë,1,1,1
2,218,1,3,6,30,Furnizimi me invertor dhe pajisje tjera te Teknologjise Informative,11.11.11,"10,000.00","9,886.40",,Online,Prishtinë,1,1,1
2,219,2,3,6,72,"Har.i proj.te inst.te rrymes elektrike, te ngroh.dhe klimatizimit",04.11.11,"10,000.00","9,100.00",,Eup Enginier,Prishtinë,1,1,1
2,220,2,3,6,50,Ripar.e ngrohjes ne objektin e ri kom dhe disa shkolla te te K. se Prishtines,09.11.11,"10,000.00","9,665.60",,Raketa,Prishtinë,1,1,1
2,221,2,3,6,92,"Realizimi I programit me rastin e Dites se Falamurit ""28 Nentori""",25.11.11,"9,500.00","9,250.00",,Sonic Sound Sol,Prishtinë,1,1,1
2,222,5,2,1,45,Zgjerimi I rruges perskaj ambasades Amerikane,24.11.11,"75,000.00","69,769.11",,Euro Garten,Lipjan,1,2,1
2,226,5,2,1,45,Renovimi I sporteleve dhe shkollave ne objektet e Komunes,06.12.11,"155,000.00","152,075.00",,Zhvillimi,Podujevë,1,1,1
2,227,5,2,1,45,Punet perfundimtare ne objektin e Bibliotekes se Qytetit,27.12.11,"170,000.00","155,101.20",,Kujtimi,Prishtinë,1,1,1
2,228,5,2,1,45,Rrethoja dhe planifikimi I oborrit te Brigades se Zjarrfiksave,27.12.11,"250,000.00","243,401.75",,Kujtimi,Prishtinë,1,1,1
2,231,1,2,1,18,Furnizimi me uniforma dimrore për punëtorët e Brigadës së Zjarrëfiksave,13.12.11,"60,000.00","49,903.00",,Amici,Prishtinë,1,1,1
2,232,1,2,1,93,Stolisja e qytetit per festat e fund vitit,25.11.11,"50,000.00","34,788.00",,Link Media Plus,Prishtinë,1,2,1
2,234,1,3,6,36,Furnizimi me stufa per shkollat e Komunes se Prishtines,25.11.11,"6,000.00","5,666.00",,Euroline,Prishtinë,1,1,1
2,235,1,3,6,36,Mobilimi I disa zyreve ne Komunen e Prishtines,25.11.11,"9,000.00","8,781.63",,Lesna,Prishtinë,1,1,1
2,236,1,2,1,28,Furnizimi dhe montimi i gomave dhe me bateri per automjetet e Komunes,12.12.11,"20,000.00","15,749.60",,Euro Delta,Fushë Ko,1,2,1
2,240,1,2,1,29,Furnizimi me kompresor per mbushjen me oksigjen te bombolave te ajrit,30.12.11,"60,000.00","47,490.00",,Tekniku,Gjakovë,1,1,1
2,242,2,3,6,92,Shpallja e sportistit te vitit dhe turneu memorial H.Talla,21.12.11,"10,000.00","9,500.00",,Juggling Shop,Prishtinë,1,1,1
2,249,5,3,6,45,Adaptimet e zyreve ne katin e IV-të,19.12.11,"6,500.00","6,294.78",,A&G,Prishtinë,1,1,1
2,251,1,3,6,36,Furnizimi me material festiv për Institucionet Parashkollore,22.12.11,"5,500.00","5,180.00",,KGT,Prishtinë,1,1,1
2,253,2,3,6,93,Sigurimi I objekteve te QPS permes sistemit te alarmit,30.12.11,"1,500.00","1,440.00",,Delta security,Prishtinë,1,1,1
2,255,2,3,6,92,Organizimi i programit për Vitin e Ri 2012 - pjesa teknike,30.12.11,"9,000.00","8,880.00",,Positive Entertain,Prishtinë,1,1,1
2,256,2,3,6,92,Organizimi i programit për Vitin e Ri 2012 - pjesa artistike,30.12.11,"9,000.00","8,300.00",,ARC Kosova,Prishtinë,1,1,1
,1,1,4,7,,Furnizimi me stufa,10.01.2011,,670,,"NTP ""Forca""",Prishtinë,1,1,1
,2,1,4,7,,Furnizimi me goma për automjete - Brigada e Zjarrfikësve,13.01.2011,,236.3,,"""Eurogoma""",Prishtinë,1,1,1
,3,1,4,7,,Furnizimi me numra të barkodeve dhe mbishkrime identifikuese për Drejt. e Infrastrukturës,01.02.2011,,995,,"NTP ""K.G.T""",Prishtinë,1,1,1
,4,1,4,7,,Furnizimi me orë dore - dhuratë për punëtorët qe pensionohen,01.03.2011,,830,,"""Watch House""",Prishtinë,1,1,1
,5,1,4,7,,Furnizimi me stufa termoakumuluese,09.03.2011,,325,,"NTP ""Forca""",Prishtinë,1,1,1
,6,1,4,7,,Furnizimi me material elektrik,24.03.2011,,893.14,,"NTSH ""El-Nazi""",Prishtinë,1,1,1
,7,2,4,7,,"Instalimi i tri lildhjeve telefonike në objektin e Komunes - ""Arbëri""",24.03.2011,,290,,"""Phone-Telecom""",Prishtinë,1,1,1
,8,1,4,7,,"Furnizimi me farë tershere për mbjellje pranverore - SHMB ""Abdyl Frashëri""",18.04.2011,,266,,"""Agrokultura""",Gllogoc,1,1,1
,008a,1,4,7,,Furnizimi me material hargjues për Bife-në e Komunës,21.04.2011,,322.96,,"""Beni Dona Plast""",Prishtinë,1,1,1
,9,1,4,7,,"Furnizimi me farë bizelje për mbjellje pranverore - SHMB ""Abdyl Frashëri""","18,04.2011",,784,,"""Agrokultura""",Gllogoc,1,1,1
,10,1,4,7,,Furnizimi me bateri për automjete - Brigada e zjarrëfikësve,20.04.2011,,981,,"""Eurogoma""",Prishtinë,1,1,1
,11,1,4,7,,"Furnizimi, montimi i DWER-it dhe hark diskut SATA 2.0",13.05.2011,,798.8,,"""Professional Alarm""",Prishtinë,1,1,1
,12,1,4,7,,"Furnizimi me pjesë për makineri në SHMB ""Abdyl Frashëri""",19.05.2011,,469,,"""Mekanizimi""",Prishtinë,1,1,1
,13,2,4,7,,"Instalimi, konfigurimi i serverit dhe intranetit për bartjen e shënimeve",24.05.2011,,475.6,,"""Ati-Kos""",Gjakovë,1,1,1
,14,1,4,7,,Furnizimi me hamburgera dhe jogurta me rastin e testit te matures,08.06.2011,,644.3,,"""Beni Dona Plast""",Prishtinë,1,1,1
,15,2,4,7,,Sigurimi (përmes vëzhgimit) i tri Qendrave për punë soc. (sipas kontr.15.06 - 31.12.2011),10.06.2011,,780,,"""Delta Security""",Prishtinë,1,1,1
,16,1,4,7,,Furnizimi me tepisona,28.06.2011,,963.9,,"""Gjini""",Prishtinë,1,1,1
,17,2,4,7,,"Servisimi, mirëmbajtja e centralit dhe rrjetit telefonik për vitin 2011",28.06.2011,,995,,"""Eltrisi""",Prishtinë,1,1,1
,19,2,4,7,,Transporti i nxënësve për nevojat e Drejtorisë për Arsim dhe Drejtorisë së Kulturës,28.06.2011,,990,,"SHA ""24 Yjet""",Prishtinë,1,1,1
,20,1,4,7,,Furnizimi me bateri për automjete - Brigada e zjarrëfikësve,15.07.2011,,264.6,,"""Eurogoma""",Prishtinë,1,1,1
,21,2,4,7,,Shpërndarja e rrjetit për internet në QPS Bregu i Diellit,01.08.2011,,309,,"""Infotrade""",Prishtinë,1,1,1
,22,1,4,7,,Furnizimi me material për riparim,08.08.2011,,908.7,,"""A-L""",Prishtinë,1,1,1
,24,2,4,7,,Transporti i arsimtarëve për testin e nxënësve,25.08.2011,,850,,"""Leci Reisen""",Prishtinë,1,1,1
,25,1,4,7,,Furnizimi me aparate dhe pompa për fikjen e zjarreve,06.09.2011,,980,,"""Pastor Kosova""",Prishtinë,1,1,1
,26,2,4,7,,"Pjesëmarrja ne Festivalin ""Festë Lojë"" në Durrës",19.09.2011,,900,,"NTP ""Azizi""",Ferizaj,1,1,1
,27,1,4,7,,Furnizimi me material dhe paisje elektrike,19.09.2011,,892.04,,"NT ""El-Nazi""",Prishtinë,1,1,1
,28,1,4,7,,"Furnizimi me televizor Plazma ""Sony""",27.09.2011,,750,,"""Gama""",Prishtinë,1,1,1
,29,1,4,7,,"Furnizimi me paisje teknike për mekanizimin e SHMB ""Abdyl Frashëri""",27.09.2011,,685,,"NTP ""Mekanizimi""",Prishtinë,1,1,1
,30,2,4,7,,Testimi i bombolave për frymarrje AUER-DRAGER-BZ,30.09.2011,,855,,"KU ""Biznesi""",Prishtinë,1,1,1
,31,2,4,7,,Organizimi i ceremonisë së varrimit,04.10.2011,,550,,"VSH ""Loti""",Prishtinë,1,1,1
,32,1,4,7,,Furnizimi me artikuj shkollor për nxënësit e Komunitetit Ashkali,06.10.2011,,732,,"NTG ""K.G.T.""",Prishtinë,1,1,1
,33,1,4,7,,"Furnizimi me farë gruri për mbjellje vjeshtore -SHMB ""A. Frashëri""",17.10.2011,,960,,"""Agrokultura""",Gllogoc,1,1,1
,34,1,4,7,,Furnizimi me stufa termoakumuluese,27.10.2011,,999,,"NT ""Forca""",Prishtinë,1,1,1
,36,1,4,7,,Furnizimi me ushqim dhe pije gjatë trajnimit të stafit të shkollave-Planifikmi i Buxhetit,14.11.2011,,839.5,,"""Beni Dona Plast""",Prishtinë,1,1,1
,37,1,4,7,,Furnizimi me mobile - garniturë për Brigadën e Zjarrëfikësve II,14.11.2011,,850,,"""Erëza""",Fushë Kos.,1,1,1