1,1,66,5,2,1,45,Renovimi i objekteve të trashëgimisë kulturore,17.05.18,17.05.18,16.05.18,06.06.18,,,03.07.18,66,4,,,12.07.18,19.07.18,,12.07.18,,," 64,163.32 ",1,1,1,jo,4,Albi Company,24.07.18,120 Ditë,,"51,708.22",1,,,,,,,,,07.11.18,"16,384.00",,,,,,,,,,NaN,Drejtoria e Kulturës,Verona Sekiraqa
1,1,56,5,2,1,45,"Ndërtimi i rrugëve Evlija Çelebi, Luan Qelaj dhe Halil Ademaj - Ritender",25.06.18,20.04.18,19.04.18,27.06.18,,,18.07.18,0,4,,0,20.04.18,07.08.18,,30.07.18,0,0,"144,250.90",1,1,1,Po,4,"NNSH ""CO-ING""",10.08.18,90 Ditë,10.11.18,"122,234.10",3,,,,,,,,,,,,,,,,,,,,NaN,Drejtoria e Investimeve Kapitale dhe Menaxhim të Kontratave,Flamur Sallahu
,1,50,1,2,1,30,Furnizimi me paisje te IT-se per vitin 2018- Ritender ,23.03.18,11.04.18,10.04.18,16.04.18,,,06.08.18,41,6,,4,07.09.18,02.10.18,,30.08.18,0,0,"95,000.00",1,1,1,Po,4,Botek,09.10.18,90 Ditë,,"49,336.00",0,,,,,,,,,,,,,,,,,,,,NaN,Drejtoria e Administratës,Albina Bajrami
,,67,2,2,1,74,Ofrimi i shërbimeve për përkthim,07.06.18,16.05.18,05.06.18,09.06.18,,,02.07.18,8,2,,1,18.07.18,25.07.18,,16.07.18,1,0," 10,000.00 ",1,1,1,,4,GCDA,31.07.18,12 Muaj,,"8,000.00",1,,,,,,,,,,,,,,,,,,,,NaN,Drejtoria e Administratës,Verona Sekiraqa 
2,1,68,5,2,1,45,Rikonstruimi i rrugëve Holgen Petersen dhe Ulëza,22.05.18,31.05.18,22.05.18,,,,,0,0,,0,,,,,,0,,,,,,3,,,,,0.00,0,,,,,,,,,,,,,,,,,,,,NaN,Drejtoria e Investimeve Kapitale dhe Menaxhim të Kontratave,Nexhmi Mekolli
2,1,70,5,2,1,45,"Rikonstruimi i rrugëve Drenica,Ukshin Hoti,Robert Doll dhe asfaltimi i shtresës se fundit te mbistruktures se rruges Enver Maloku ",28.05.18,04.06.18,06.06.18,12.06.18,,,09.07.18,15,,,0,,,09.07.18,,,0,"178,162.00",1,1,,,3,,,,,0.00,0,,,,,,,,,,,,,,,,,,,,NaN,Drejtoria e Investimeve Kapitale dhe Menaxhim të Kontratave,Albina Bajrami
2,1,70,5,2,1,45,"Rikonstruimi i rrugëve Drenica,Ukshin Hoti,Robert Doll dhe asfaltimi i shtresës se fundit te mbistruktures se rruges Enver Maloku-Ritender ",28.05.18,04.06.18,06.06.18,10.07.18,,1,02.08.18,29,3,,3,,,05.11.18,,,0,"178,162.00",,,,,3,,,,,0.00,0,,,,,,,,,,,,,,,,,,,,NaN,Drejtoria e Investimeve Kapitale dhe Menaxhim të Kontratave,Albina Bajrami
2,1,71,5,2,1,45,Rikonstruimi i rrugës Eqrem Qabej nga udhëkryqi i Katedrales deri tek Udhëkryqi i Menses së studentëve,22.05.18,31.05.18,10.06.18,12.06.18,,,06.07.18,18,3,,2,20.08.18,11.09.18,,21.08.18,,0,"168,096.15",1,1,1,,4,Papenburg Adriani Company ,14.09.18,90 ,,"160,981.01",0,,,,,,,,,20.11.18,"50,000",26.11.18,"50,000",,,,,,,,NaN,Drejtoria e Investimeve Kapitale dhe Menaxhim të Kontratave,Shqipe Isufi 
2,1,73,4,2,1,,"Konkurs projektimi  ""Konservimi dhe adaptimi i ndërtesës së ish-kadastrit të Prishtinës",,,13.06.18,22.05.18,,,20.07.18,0,0,,0,,,15.03.19,,,0,"60,000.00",,,,,,,,,,0.00,0,,,,,,,,,,,,,,,,,,,,NaN,Drejtoria e Arsimit,Flamur Sallahu
2,1,74,5,2,1,45,Ndërtimi i Laboratorit në SHMT 28 Nëntori Prishtinë-faza e dytë,11.04.18,11.04.18,15.05.18,07.06.18,,,02.07.18,42,9,,1,13.08.18,20.08.18,,07.08.18,,0,"60,000.00",1,1,1,jo,4,Tribuna,24.08.18,60 Ditë,,"37,908.70",,,,,,,,,,,,,,,,,,,,,NaN,Drejtoria e Arsimit,Valmire Mustafa
,,75,1,2,1,45,"Furnizimi dhe montimi i totemave, sinjalizuesve turistik",25.06.18,16.05.18,23.06.18,,,,,0,0,,0,,,,,1,0,,1,1,1,,3,,,,,0.00,0,,,,,,,,,,,,,,,,,,,,NaN,Drejtoria e Kulturës,Verona Sekiraqa 
2,1,77,5,2,1,45,Renovimi i ndërtesave për mbrojtje të trashëgimisë kulturore,27.06.18,22.06.18,01.07.18,29.06.18,1,1,23.07.18,4,4,,1,22.09.18,11.12.18,,12.11.18,1,1,"110,000.00",1,1,1,,4,"""Albi Company"" sh.p.k.",13.12.18,12 Muaj,13.12.19,"73,941.16",0,,,,,,,,,,,,,,,,,,,,NaN,Drejtoria e Kulturës,Flamur Sallahu
2,1,78,5,2,1,45,Shpimi i puseve dhe ndërtimi i sistemit të ujitjes për gjelbrim ,14.06.18,21.06.18,01.07.18,11.07.18,,,06.08.18,33,4,,1,20.08.18,28.09.18,,22.08.18,,0,"150,000.00",1,1,1,,4,Niti-i&Caja Company,04.10.18,12 Muaj,,0.00,0,,,,,,,,,,,,,,,,,,,,NaN,Drejtoria e Shërbimeve Publike,Shehide Jashari
1,1,79,1,1,1,40,Furnizimi me makineri dhe paisje,10.07.18,16.05.18,09.07.18,13.07.18,,,30.08.18,22,1,,0,17.09.18,25.09.18,,17.09.18,,0,"146,600.00",1,1,1,,4,Agribau,09.10.18,60 Ditë,,"146,600.00",0,,,,,,,,,,,,,,,,,,,,NaN,Drejtoria e Shërbimeve Publike,Valmire Mustafa
1,1,80,5,2,1,45,Zgjerimi dhe modernizimi i rrjetit të ndriqimit Publik në zonat e qytetit dhe rurale - Faza II,18.06.18,28.06.18,25.06.18,13.07.18,,,10.08.18,26,9,,1,25.08.18,05.09.18,,26.08.18,0,0,"135,000.00",1,1,,,,Niti,10.09.18,12 Muaj,,"58,827.00",0,,,,,,,,,,,,,,,,,,,,NaN,Drejtoria e Shërbimeve Publike,Albina Bajrami
2,1,81,2,2,1,,Mirëmbajtja dhe pastrimi i objektit të ri komunal dhe disa instituciioneve tjera komunale,17.07.18,28.06.18,09.07.18,20.07.18,2,,06.08.18,6,6,,3,05.10.18,,,20.09.18,2,0,"120,000.00",1,1,1,,4,"N.T.SH. ""AB-CLEAN""",05.10.18,36 Muaj,,"105,552.00",0,,,,,,,,,,,,,,,,,,,,NaN,Drejtoria e Administratës,Flamur Sallahu
1,1,82,2,,2,,"Pastrimi i objekteve të Komunës së Prishtinës - Objekti i vjetër i Komunës, Objekti i Inspekcionit,  Objekti i ri i Arkivit Komunal, Objekti i Qendrës për Punë Sociale si dhe Objekte tjera sipas nevojës",12.07.18,12.07.18,11.07.18,13.07.18,,,18.07.18,1,1,,0,,23.07.18,,,,0,"20,000.00",1,1,1,jo,4,MSS,23.07.18,3 Muaj,,"10,561.59",0,,,,,,,,,,,,,,,,,,,,NaN,Drejtoria e Administratës,Flamur Sallahu
,,86,5,2,1,45,"Ndërtimi i rrugës lidhëse me rrugët Fatime Sokoli, Vehap Shita dhe Tahir Zajmi",19.07.18,12.07.18,02.07.18,21.07.18,,,10.07.18,39,5,,0,04.09.18,04.09.18,,29.08.18,0,0,"262,124.93",1,1,1,,4,Gashi Ing,07.09.18,60 Ditë,,"186,721.76",0,,,,,,,,,,,,,,,,,,,,NaN,Drejtoria e Investimeve Kapitale dhe Menaxhim të Kontratave,Verona Sekiraqa 
,,87,1,2,1,32,Furnizimi me 10 aparata fotografik profesional  për nevoja të Komunës,18.07.18,16.05.18,12.07.18,20.07.18,,,30.07.18,26,2,,0,13.08.18,10.08.18,,02.08.18,0,0,"6,000.00",1,1,1,,4,Gertech,22.08.18,30 Ditë,,"4,955.76",0,,,,,,,,,,,,,,,,,,,,NaN,Drejtoria e Administratës,Verona Sekiraqa 
,,88,1,2,1,,Furnizimi i ambulanave për nevojat e QKMF-së dhe QMU - Lot I,08.06.18,28.06.18,18.06.18,25.07.18,,,16.08.18,23,3,,0,17.09.18,27.09.18,,18.09.18,,0,"120,000.00",1,1,1,,4,"""Delfini Auto"" Sh.P.K",04.10.18,90 Ditë,,"26,420.00",1,,,,,,,,,,,,,,,,,,,,NaN,Drejtoria e Shëndetësisë,Shehide Jashari
,,89,5,2,1,,Ndërtimi i këndeve dhe fushave sportive në Komunën e Prishtinës,24.07.18,,,,,,,0,0,,0,,,,,,0,,,,,,,,,,,,0,,,,,,,,,,,,,,,,,,,,NaN,Drejtoria e Kulturës,Flamur Sallahu
,,91,5,2,1,45,Riparimi dhe rregullimi i ashensorëve,02.08.18,12.07.18,24.07.18,04.08.18,,,27.08.18,28,5,,0,13.09.18,28.09.18,,19.09.18,0,0,"100,000.00",1,1,1,,4,Rima enginering,01.10.18,12 Muaj,,"89,889.96",0,,,,,,,,,,,,,,,,,,,,NaN,Drejtoria e Shërbimeve Publike,Verona Sekiraqa 
,1,92,5,2,1,45,"Ndërtimi i rrugës ""Rimanshtë-Sharban""-Prishtinë",31.07.18,26.07.18,10.07.18,02.08.18,,,11.07.18,58,12,,0,24.10.18,30.10.18,,23.10.18,0,0,"982,303.60",1,1,1,jo,4,Bageri,02.11.18,120 Ditë,,"564,648.77",12,,,,,,,,,,,,,,,,,,,,NaN,Drejtoria e Investimeve Kapitale dhe Menaxhim të Kontratave,Verona Sekiraqa 
1,1,93,1,2,1,26,Furnizim me inventarë për nevojat e Institucioneve shëndetësore dhe sociale,26.07.18,26.07.18,01.08.18,15.08.18,,,10.09.18,24,1,,1,04.10.18,09.10.18,,08.10.18,0,0,"15,109.00",1,1,1,,4,MALI,19.10.18,60 Ditë,,"14,986.80",0,,,,,,,,,,,,,,,,,,,,NaN,Drejtoria e Shëndetësisë,Kaltrina Dalipi
1,1,95,5,2,1,45,Ndërtimi i sallës së edukatës fizike Avni Rrustemi në Mramor,30.07.18,01.08.18,01.08.18,09.08.18,,,30.08.18,55,10,,2,04.10.18,23.10.18,,31.08.18,0,0,"197,450.38",1,1,1,jo,4,A con,23.10.18,150 Ditë,,"167,257.80",3,,,,,,,,,,,,,,,,,,,,NaN,Drejtoria e Arsimit,Nexhmi Mekolli
2,1,96,5,2,1,45,Rekonstruimi i rrugës Ndue Përlleshi dhe rrugës Shaqir Igrishta ,03.07.18,12.07.18,06.08.18,08.08.18,,,10.08.18,24,9,,1,28.09.18,16.10.18,,09.10.18,0,0,"213,681.00",1,1,1,,4,Gerlica Company,23.10.18,90 Ditë,,"163,190.00",0,,,,,,,,,,,,,,,,,,,,NaN,Drejtoria e Investimeve Kapitale dhe Menaxhim të Kontratave,Albina Bajrami
2,1,99,1,2,,,Furnizimi me material pedagogjik shkollor Dukagjini,09.08.18,23.07.18,08.08.18,14.08.18,,,23.08.18,4,1,,0,04.09.18,06.09.18,,05.09.18,,0,21550,1,1,1,jo,4,Dukagjini,25.09.18,12 Muaj,,"21,550.00",0,,,,,,,,,,,,,,,,,,,,NaN,Drejtoria e Arsimit,Valmire Mustafa
2,1,100,1,3,,,Furnizimi me material pedagogjik shkollor - Libri Shkollor ,09.08.18,23.07.18,08.08.18,14.08.18,,,27.08.18,3,1,,0,04.09.18,06.09.18,,05.09.18,,0,10038.80,1,1,1,jo,4,Libri shkollor,19.09.18,12 Muaj,,"10,038.80",0,,,,,,,,,,,,,,,,,,,,NaN,Drejtoria e Arsimit,Valmire Mustafa
2,1,101,1,1,1,74,Kryerja e shërbimeve të ankandit publik,14.08.18,07.08.18,08.08.18,15.08.18,,,06.09.18,8,1,,0,17.09.18,24.09.18,,17.09.18,0,0,"15,000.00",1,1,1,,4,Shtëpia e ankandeve ,27.09.18,90 Ditë,,0.00,0,,,,,,,,,,,,,,,,,,,,NaN,Drejtoria e Administratës,Verona Sekiraqa 
2,1,104,5,2,1,45,Renovime dhe Rindertime,02.08.18,07.08.18,14.08.18,16.08.18,,,13.08.18,75,7,,4,19.10.18,31.10.18,,20.10.18,0,0,"420,000.00",1,1,1,,4,Ulpiana,02.11.18,36 Muaj,,"334,267.50",0,,,,,,,,,,,,,,,,,,,,NaN,Drejtoria e Shëndetësisë,Albina Bajrami
2,1+2,105,5,2,1,45,"Rregullimi i oborreve të shkollave ""Elena Gjika"" dhe ""Dardania""",02.08.18,13.08.18,16.08.18,20.08.18,,,03.09.18,28,4,,0,25.09.18,26.09.18,,13.09.18,,0,146137.50,1,2,1,,4,Mati&Ulpiana,03.10.18,90 Ditë,,"107,777.77",2,,,,,,,,,,,,,,,,,,,,NaN,Drejtoria e Investimeve Kapitale dhe Menaxhim të Kontratave,Nexhmi Mekolli
2,1,69,2,1,1,93,Shërbimet e transportit me marimangë II,04.06.18,04.06.18,03.06.18,08.06.18,,,16.07.18,13,4,,3,24.08.18,,,26.08.18,1,1,"250,000.00",1,1,1,,3,,,,,0.00,0,,,,,,,,,,,,,,,,,,,,NaN,Drejtoria e Shërbimeve Publike,Kaltrina Dalipi
,1,76,5,2,1,45,Ndërtimi i parkut në Mat,20.06.18,21.06.18,19.06.18,28.06.18,,,20.07.18,83,5,,0,17.09.18,03.10.18,,07.10.18,,0,227794.36,1,1,1,,4,Ulpiana,03.10.18,80 Ditë,,"153,787.24",3,,,,,,,,,,,,,,,,,,,,NaN,Drejtoria e Investimeve Kapitale dhe Menaxhim të Kontratave,Nexhmi Mekolli
1,,15,2,1,1,93,Mirëmbajtja verore e rrugëve dhe trotuareve - pjesa e I,13.02.18,21.02.18,26.03.18,29.03.18,,,23.04.18,25,8,,2,08.05.18,10.05.18,,12.04.18,0,0,"640,000",1,1,1,jo,4,VZ Company,29.05.18,36 Muaj,,"138,255.87",,,,,,,,,,,,,,,,,,,,,NaN,Drejtoria e Shërbimeve Publike,Nexhmi Mekolli
1,,15,2,1,1,93,Mirëmbajtja verore e rrugëve dhe trotuareve - pjesa e II,13.02.18,21.02.18,26.03.18,29.03.18,1,1,23.04.18,25,8,,3,08.05.18,10.05.18,,12.04.18,1,1,"640,000.00",1,1,1,,4,Toifor,,36 Muaj,,"199,882.99",36,,,,,,,,,,,,,,,,,,,,NaN,Drejtoria e Shërbimeve Publike,Nexhmi Mekolli
,,15,2,1,1,93,Mirëmbajtja verore e rrugëve dhe trotuareve -  pjesa III,13.02.18,21.02.18,26.03.18,29.03.18,,,23.04.18,25,8,,4,08.05.18,10.05.18,,12.04.18,0,0,"640,000.00",1,1,1,jo,1,Dardania,29.05.18,36 Muaj,,"284,997.96",36,,,,,,,,,,,,,,,,,,,,NaN,Drejtoria e Shërbimeve Publike,Nexhmi Mekolli
1,,15,2,1,1,93,Mirëmbajtja verore e rrugëve dhe trotuareve - pjesa IV,13.02.18,21.02.18,26.03.18,29.03.18,,,23.04.18,25,8,,2,08.05.18,10.05.18,,12.04.18,0,0,"640,000.00",1,1,1,jo,4,Niti-N,29.05.18,36 Muaj,,"187,823.26",36,,,,,,,,,,,,,,,,,,,,NaN,Drejtoria e Shërbimeve Publike,Nexhmi Mekolli
,,15,2,1,1,93,Mirëmbajtja verore e rrugëve dhe trotuareve - pjesa V,13.02.18,21.02.18,26.03.18,29.03.18,,,23.04.18,25,8,,2,08.05.18,10.05.18,,12.04.18,0,0,"640,000.00",1,1,1,jo,4,Zahiri,29.05.18,36 Muaj,,"192,896.00",36,,,,,,,,,,,,,,,,,,,,NaN,Drejtoria e Shërbimeve Publike,Nexhmi Mekolli
1,,15,2,1,1,93,Mirëmbajtja verore e rrugëve dhe trotuareve - pjesa VI,13.02.18,21.02.18,26.03.18,29.03.18,,,23.04.18,25,8,,2,08.05.18,10.05.18,,12.04.18,0,0,"640,000.00",1,1,1,jo,4,Pastrimi,29.05.18,36 Muaj,,"244,608.37",36,,,,,,,,,,,,,,,,,,,,NaN,Drejtoria e Shërbimeve Publike,Nexhmi Mekolli
1,1,22,5,2,1,45,"Rikonstruksioni i dyshemeve , gëlqerosja dhe rikonstruimi i nyjeve sanitare ne Intstitucionet ArsimoreLOT -I",11.12.17,12.12.17,26.04.18,02.05.18,,,25.05.18,74,15,,2,06.07.18,17.07.18,,23.07.18,,0,"250,000.00",1,1,1,,4,Zhvillimi,20.07.18,12 Muaj,,"59,072.50",0,,,,,,,,,,,,,,,,,,,,NaN,Drejtoria e Arsimit,Albina Bajrami
1,1,22,5,2,1,45,"Rikonstruksioni i dyshemeve , gëlqerosja dhe rikonstruimi i nyjeve sanitare ne Intstitucionet ArsimoreLOT -II",11.12.17,12.12.17,26.04.18,02.05.18,,,25.05.18,74,15,,2,06.07.18,17.07.18,,23.07.18,,0,"250,000.00",1,1,1,,4,Euro Construction,20.07.18,12 Muaj,,"69,659.90",0,,,,,,,,,,,,,,,,,,,,NaN,Drejtoria e Arsimit,Albina Bajrami
1,1,22,5,2,1,43,"Rikonstruksioni i dyshemeve , gëlqerosja dhe rikonstruimi i nyjeve sanitare ne Intstitucionet ArsimoreLOT -III",11.12.17,12.12.17,26.04.18,02.05.18,,,25.05.18,74,15,,2,06.07.18,17.07.18,,23.07.18,,0,"250,000.00",1,1,1,,4,Lindi,20.07.18,12 Muaj,,"48,000.00",,,,,,,,,,,,,,,,,,,,,NaN,Drejtoria e Arsimit,Shqipe Isufi
,1,50,1,2,1,30,Furnizimi me paisje të IT-së për vitin 2018- Ritender -Lot 2,23.03.18,11.04.18,10.04.18,16.04.18,,,06.08.18,41,6,,4,07.09.18,02.10.18,,30.08.18,0,0,"95,000.00",1,1,1,Po,4,EuroPrinty,05.10.18,90 Ditë,,"23,179.00",0,,,,,,,,,,,,,,,,,,,,NaN,Drejtoria e Administratës,Albina Bajrami
,,75,1,2,1,45,"Furnizimi dhe montimi i totemave, sinjalizuesve turistik-ritender",27.08.18,07.06.18,23.06.18,28.08.18,,,19.09.18,23,2,,0,10.10.18,10.10.18,,30.09.18,0,0,"25,000.00",1,1,1,Po,4,Grafo-Loni,18.10.18,30 Ditë,,"24,870.00",,,,,,,,,,,,,,,,,,,,,NaN,Drejtoria e Kulturës,Verona Sekiraqa 
1,1,80,5,2,1,45,Zgjerimi dhe modernizimi i rrjetit të ndriçimit publik në zonat e qytetit dhe rurale - Faza II,18.06.18,28.06.18,25.06.18,13.07.18,,,10.08.18,26,9,,1,25.08.18,05.09.18,,26.08.18,0,0,"135,000.00",1,1,1,,4,Niti,10.09.18,12 Muaj,,"58,827.00",0,,,,,,,,,,,,,,,,,,,,NaN,Drejtoria e Shërbimeve Publike,Albina Bajrami
1,1,106,5,2,1,45,Rekonstruimi i  rrugës dhe trotuareve në rrugën Vëllezërit Fazliu,11.07.18,07.08.18,07.08.18,20.08.18,,,14.09.18,38,3,,2,07.10.18,16.10.18,,09.10.18,0,0,"449,010.09",1,1,1,,4,Gerlica Company,19.10.18,120 Ditë,,"378,558.58",0,,,,,,,,,,,,,,,,,,,,NaN,Drejtoria e Investimeve Kapitale dhe Menaxhim të Kontratave,Shqipe Isufi
1,1,112,2,2,1,93,Mirëmbajtja e pajisjeve mjekësore ,08.08.18,13.08.18,06.09.18,10.09.18,,,01.10.18,25,1,,0,16.10.18,17.10.18,,14.10.18,0,0,"59,000.00",1,1,1,jo,4,Mam,23.10.18,36 Muaj,,"9,536.16",0,,,,,,,,,,,,,,,,,,,,NaN,Drejtoria e Shëndetësisë,Nexhmi Mekolli
1,1,94,2,2,1,74,"Hartimi i projekteve për objekte, plotësim i objekteve për projekt dhe shqyrtim i konstruksionit nga aspekti i stabilitetit dhe funksionalitetit",22.06.18,04.07.18,01.08.18,19.10.18,,,05.09.18,26,4,,0,19.10.18,22.10.18,,10.10.18,0,0,"60,000.00",1,1,1,jo,4,Rimi Eng,26.10.18,12 Muaj,26.10.19,"47,908.00",12,,,,,,,,,,,,,,,,,,,,NaN,Drejtoria e Investimeve Kapitale dhe Menaxhim të Kontratave,Nexhmi Mekolli
,,107,2,1,2,74,Hartimi i projekteve për implementimin e standardit për siguri dhe mbrojtje të lëndës arkivore,22.08.18,12.07.18,11.07.18,23.08.18,,,14.09.18,13,2,,0,01.10.18,11.10.18,,03.10.18,0,0,"10,000.00",1,1,1,,4,"Grup i Operatorëve Ekonomik: "" CALL - HOME ELEKTRONICS "" SH.P.K.; "" Advanced Group of Architecture ""  SH.P.K.",15.10.18,60 Ditë,,"4,400.00",0,,,,,,,,,,,,,,,,,,,,NaN,Drejtoria e Kulturës,Verona Sekiraqa 
,,111,1,3,,,"Ndërtimi i Konstruksioneve metalike për përvjetorin e arkitektit ""Rexhep Luci""",24.08.18,24.08.18,03.09.18,04.09.18,,,13.09.18,21,5,,1,24.09.18,01.10.18,,24.09.18,,,"7,090.62",1,1,1,,4,MBB Construction,03.10.18,10 Ditë,,"3,870.40",0,,,,,,,,,,,,,,,,,,,,NaN,Drejtoria e Administratës,Shehide Jashari
,1+2,120,5,2,1,45,Ndërtimi i parkut  Dielli tek kompleksi i Banesave të Bardha,10.10.18,05.10.18,04.10.18,18.10.18,,,14.11.18,43,4,,0,,,,,,,"88,015.20",1,1,1,,,,,,,0.00,0,,,,,,,,,,,,,,,,,,,,NaN,Drejtoria e Investimeve Kapitale dhe Menaxhim të Kontratave,Verona Sekiraqa 
,,121,5,2,1,45,Riparimi i shkallëve përreth ndërtesave kolektive ,15.10.18,07.08.18,11.10.18,16.10.18,,,13.11.18,53,5,,1,24.11.18,04.12.18,,25.11.18,0,0,"70,000.00",1,1,1,,4,Rexha ,07.12.18,90 Ditë,,"47,939.80",0,,,,,,,,,,,,,,,,,,,,NaN,Drejtoria e Shërbimeve Publike,Valmire Mustafa
,,123,1,1,1,,Furnizim me material shpenzues për shërbime stomatologjike ,16.10.18,25.09.18,15.10.18,16.10.18,,,09.11.18,2,2,,0,25.09.18,20.12.18,,03.12.18,0,0,"246,500.00",1,1,1,,4,"""Matkos Pharm"" Sh.p.k",17.12.18,36 Muaj,17.12.21,"169,755.00",0,,,,,,,,,,,,,,,,,,,,NaN,Drejtoria e Shëndetësisë,Flamur Sallahu
,,125,2,1,1,,Pastrimi i objekteve shkollore,05.10.18,09.10.18,22.10.18,23.10.18,,,10.12.18,36,11,,4,,01.02.19,,,,,"228,000.00",1,1,1,,1,Beni,04.02.19,12 Muaj,,"147,916.42",0,,,,,,,,,,,,,,,,,,,,NaN,Drejtoria e Arsimit,Albina Bajrami
2,1,127,5,3,6,45,Ndërtimi i hyrjes Kino Armata,04.10.18,04.10.18,03.10.18,31.10.18,,,09.11.18,19,5,,0,24.11.18,29.11.18,,22.11.18,0,0,"9,000.00",1,1,1,,4,Ero Project,03.12.18,10 Ditë,,"6,957.00",0,,,,,,,,,,,,,,,,,,,,NaN,Drejtoria e Kulturës,Kaltrina Dalipi
2,1,129,2,2,1,,Mirëmbajtja e ngrohjes qendrore në shkollat dhe institucionet tjera komunale,25.10.18,12.09.18,21.10.18,25.10.18,,,23.11.18,19,3,,1,11.12.18,08.01.19,,27.12.18,0,0,"50,000.00",1,1,1,,4,Raketa,09.01.19,12 ,09.01.20,"12,506.00",0,,,,,,,,,,,,,,,,,,,,NaN,Drejtoria e Arsimit,Valmire Mustafa
2,1,130,5,2,1,,Deponia e mbeturinave prapa Shkollës Model ,27.10.18,20.08.18,28.10.18,29.10.18,,,21.11.18,5,5,,0,20.08.18,07.12.18,,28.11.18,0,0,"24,370.00",1,1,1,,4,"N.P.N. ""LINDI""",07.12.18,60 Ditë,07.02.19,"17,588.00",0,,,,,,,,,,,,,,,,,,,,NaN,Drejtoria e Investimeve Kapitale dhe Menaxhim të Kontratave,Flamur Sallahu
1,1,131,5,2,1,45,Sinjalizimi horizontal dhe vertikal i rrugëve - faza e II-të 2018,24.07.18,07.08.18,06.08.18,16.12.18,1,,09.01.19,23,4,,1,19.02.19,28.02.19,,13.02.19,1,0,"50,000.00",1,1,1,Po,4,Sinjal Sh.P.K,05.03.19,12 Muaj,,"50,000.00",0,,,,,,,,,,,,,,,,,,,,NaN,Drejtoria e Shërbimeve Publike,Nexhmi Mekolli
,,132,1,3,6,,Furnizimi me perde për institucionet arsimore ,31.10.18,11.09.18,30.10.18,31.10.18,,,08.11.18,17,4,,0,05.12.18,18.12.18,,10.12.18,,,"5,000.00",1,1,,,4,"N.P.T ""Arhing""",26.12.18,15 Ditë,,"3,320.00",0,,,,,,,,,,,,,,,,,,,,NaN,Drejtoria e Arsimit,Shehide Jashari
2,1,102,1,1,1,,Furnizime për zyre me material  të shtypur dhe materiale tjera që nuk janë të paraqitura në listën e AQP,31.07.18,01.08.18,12.08.18,15.08.18,,,28.09.18,21,5,,2,24.10.18,01.11.18,,25.10.18,0,0,"171,000.00",1,1,1,,4,Blendi,07.11.18,36 Muaj,07.11.21,"146,009.70",0,,,,,,,,,,,,,,,,,,,,NaN,Drejtoria e Administratës,Shqipe Isufi
,,97,1,3,6,45,"Furnizimi dhe montimi i kaldasë së shkollës ""Mehmet Xhevori""",08.10.18,07.10.18,06.10.18,08.10.18,,,19.10.18,17,4,,0,31.10.18,06.11.18,,30.10.18,0,0,"9,800.00",1,1,1,jo,4,Termo Consig,09.11.18,30 Ditë,,"8,333.00",1,,,,,,,,,,,,,,,,,,,,NaN,Drejtoria e Arsimit,Verona Sekiraqa 
,1,89,5,2,1,,Ndërtimi i këndeve dhe fushave sportive në Komunën e Prishtinës,12.09.18,04.09.18,03.09.18,12.09.18,,,08.10.18,4,4,,1,04.09.18,08.11.18,,29.10.18,0,0,"450,000.00",1,1,1,,4,Grup i Operatorëve Ekonomik: Ulpiana & Daqa,13.11.18,3 Muaj,13.02.18,"341,717.45",0,,,,,,,,,,,,,,,,,,,,NaN,Drejtoria e Kulturës,Flamur Sallahu
1,1,90,1,1,1,33,Furnizimi me pajisje mjekësore për QKMF dhe  QMU-lloto I,24.07.18,20.04.18,23.07.18,01.08.18,,,17.09.18,31,12,,0,30.10.18,07.11.18,,31.10.18,0,0,"235,000.00",1,1,1,jo,4,Komed,09.11.18,60 Ditë,,"8,850.00",0,,,,,,,,,,,,,,,,,,,,NaN,Drejtoria e Shëndetësisë,Valmire Mustafa
1,1,90,1,1,1,33,Furnizimi me pajisje mjekësore për QKMF dhe  QMU-lloto II,24.07.18,20.04.18,23.07.18,01.08.18,,,17.09.18,31,12,,5,30.10.18,07.11.18,,31.10.18,0,0,"235,000.00",1,1,1,jo,4,Komed,09.11.18,60-Dite,,"75,600.00",0,,,,,,,,,,,,,,,,,,,,NaN,Drejtoria e Shëndetësisë,Valmire Mustafa
1,1,90,1,1,1,33,Furnizimi me pajisje mjekësore për QKMF dhe  QMU-lloto III,24.07.18,20.04.18,23.07.18,01.08.18,,,17.09.18,31,12,,0,30.10.18,07.11.18,,31.10.18,0,0,"235,000.00",1,1,1,jo,4,Atomed,09.11.18,60-Dite,,"6,150.00",0,,,,,,,,,,,,,,,,,,,,NaN,Drejtoria e Shëndetësisë,Valmire Mustafa
1,1,90,1,1,1,33,Furnizimi me pajisje mjekësore për QKMF dhe QMU-lloto IV,24.07.18,20.04.18,23.07.18,01.08.18,,,17.09.18,31,12,,2,30.10.18,07.11.18,,31.10.18,0,0,"235,000.00",1,1,1,jo,4,Yesspharma,09.11.18,60-Dite,,"17,820.00",0,,,,,,,,,,,,,,,,,,,,NaN,Drejtoria e Shëndetësisë,Valmire Mustafa
1,1,90,1,1,1,33,Furnizimi me pajisje mjekësore për QKMF dhe  QMU-lloto V,24.07.18,20.04.18,23.07.18,01.08.18,,,17.09.18,31,12,,2,30.10.18,07.11.18,,31.10.18,1,0,"235,000.00",1,1,1,jo,4,Konti,09.11.18,60-Dite,,"10,586.00",0,,,,,,,,,,,,,,,,,,,,NaN,Drejtoria e Shëndetësisë,Valmire Mustafa
1,1,90,1,1,1,33,"Furnizimi me pajisje mjekësore për QKMF dhe  QMU-llotoVII, Vlll, IX",24.07.18,20.04.18,23.07.18,01.08.18,,,17.09.18,31,12,,0,30.10.18,07.11.18,,31.10.18,0,0,"235,000.00",1,1,1,jo,1,Letamed,12.11.18,60-Dite,,54845,0,,,,,,,,,,,,,,,,,,,,NaN,Drejtoria e Shëndetësisë,Valmire Mustafa
1,1,90,1,1,1,33,Furnizimi me pajisje mjekësore për QKMF dhe  QMU-lloto X,24.07.18,20.04.18,23.07.18,01.08.18,,,17.09.18,31,12,,0,30.10.18,07.11.18,,31.10.18,0,0,"235,000.00",1,1,1,jo,4,Matkos Pharm,09.11.18,60-Dite,,"6,635.00",0,,,,,,,,,,,,,,,,,,,,NaN,Drejtoria e Shëndetësisë,Valmire Mustafa
1,1,90,1,1,1,33,Furnizimi me pajisje mjekësore për QKMF dhe  QMU-lloto XI,24.07.18,20.04.18,23.07.18,01.08.18,,,18.09.18,31,12,,0,30.10.18,07.11.18,,31.10.18,0,0,"235,000.00",1,1,1,jo,4,Agani L.T.D,09.11.18,60-Dite,,"1,500.00",0,,,,,,,,,,,,,,,,,,,,NaN,Drejtoria e Shëndetësisë,Valmire Mustafa
,,59,1,2,1,,"Furnizim me pajisje elektronike, elektrike dhe mekanike",24.04.18,25.04.18,01.05.18,04.05.18,,,12.07.18,30,3,,1,22.06.18,04.07.18,,24.06.18,,,"24,000.00",1,1,1,jo,4,Oni Design,02.08.18,30 Ditë,,"21,206.00",0,,,,,,,,,,,,,,,,,,,,NaN,Drejtoria e Kulturës,Shehide Jashari
,,137,2,1,2,,"Pastrimi dhe dezinfektimi i podrumeve dhe garazhave në rrugën ""B""",07.11.18,17.11.18,16.11.18,07.11.18,,,14.11.18,19,3,,0,15.11.18,21.11.18,,14.11.18,0,0,,1,1,1,,4,"""Niti-N"" Sh.P.K",23.11.18,5 Ditë,,"6,400.00",0,,,,,,,,,,,,,,,,,,,,NaN,Drejtoria e Shërbimeve Publike,Verona Sekiraqa 
1,1,119,2,2,1,93,Trajtimi i qenëve endacak,09.10.18,07.08.18,08.08.18,11.10.18,,,06.11.18,8,1,,0,24.11.18,29.11.18,,22.11.18,0,0,"100,000.00",1,1,1,,4,Qendra për trajtimin e kafshëve ,04.12.18,12 Muaj,,17.85,0,,,,,,,,,,,,,,,,,,,,NaN,Drejtoria e Shërbimeve Publike,Kaltrina Dalipi
,1,142,1,3,6,,"Organizimi i panairit ""Blej Shqip 2018""",07.11.18,08.11.18,12.11.18,13.11.18,1,,21.11.18,16,3,,0,21.11.18,26.11.18,,20.11.18,0,0,"9,950.00",1,1,1,,4,Compass IT sh.p.k,27.11.18,3 Ditë,,"6,777.00",0,,,,,,,,,05.12.18,,,,,,,,,,,NaN,Drejtoria e Planifikimit Strategjik dhe Zhvillim të Qëndrueshëm,Albina Bajrami
1,1,109,5,1,1,45,Vazhdimi i ndërtimit të rrugës Sharban-Koliq,15.08.18,24.08.18,03.09.18,06.09.18,,,18.10.18,46,7,,2,19.11.18,26.11.18,,19.11.18,,,"502,368.74",1,1,1,,4,"Grupi i Operatorëve Ekonomik ""Beni Construction sh.p.k & SB Construction sh.p.k""",29.11.18,90 Ditë,,"402,097.12",0,,,,,,,,,,,,,,,,,,,,NaN,Drejtoria e Investimeve Kapitale dhe Menaxhim të Kontratave,Albina Bajrami
2,1,149,5,2,,45,Mirëmbajtja dimërore emergjente - procedurë e negociuar- Lot 1,20.11.18,20.11.18,19.11.18,20.11.18,,,23.11.18,6,6,,0,27.11.18,26.11.18,,25.11.18,0,0,"180,000.00",1,2,1,,4,Dardania,23.11.18,60 Ditë,,"25,276.23",0,,,,,,,,,,,,,,,,,,,,NaN,Drejtoria e Shërbimeve Publike,Shqipe Isufi
2,1,149,5,2,,45,Mirëmbajtja dimërore emergjente - procedurë e negociuar- Lot 2,20.11.18,20.11.18,19.11.18,20.11.18,,,23.11.18,6,6,,0,27.11.18,26.11.18,,25.11.18,,,"180,000.00",1,2,1,,4,Toifor,23.11.18,60 Ditë,,"30,482.37",0,,,,,,,,,,,,,,,,,,,,NaN,Drejtoria e Shërbimeve Publike,Shqipe Isufi
2,1,149,5,2,,45,Mirëmbajtja dimërore emergjente - procedurë e negociuar- Lot 3,20.11.18,20.11.18,19.11.18,20.11.18,,,23.11.18,6,6,,0,27.11.18,26.11.18,,25.11.18,0,0,"180,000.00",1,2,1,,4,VZ Company,23.11.18,60 Ditë,,"35,922.88",0,,,,,,,,,,,,,,,,,,,,NaN,Drejtoria e Shërbimeve Publike,Shqipe Isufi
2,1,149,5,2,,45,Mirëmbajtja dimërore emergjente - procedurë e negociuar- Lot 4,20.11.18,20.11.18,19.11.18,20.11.18,,,23.11.18,6,6,,0,27.11.18,26.11.18,,25.11.18,0,0,"180,000.00",1,2,1,,4,VE mor sh.p.k,23.11.18,60 Ditë,,"22,062.07",0,,,,,,,,,,,,,,,,,,,,NaN,Drejtoria e Shërbimeve Publike,Shqipe Isufi
2,1,149,5,2,,45,Mirëmbajtja dimërore emergjente - procedurë e negociuar- Lot 5,20.11.18,20.11.18,19.11.18,20.11.18,,,23.11.18,6,6,,0,27.11.18,26.11.18,,25.11.18,0,0,"180,000.00",1,2,1,,4,"Kompania Rajonale e mbeturinave ""Pastrimi""",23.11.18,60 Ditë,,"34,301.35",0,,,,,,,,,,,,,,,,,,,,NaN,Drejtoria e Shërbimeve Publike,Shqipe Isufi
2,1,149,5,2,,45,Mirëmbajtja dimërore emergjente - procedurë e negociuar- Lot 6,20.11.18,20.11.18,19.11.18,20.11.18,,,23.11.18,6,6,,0,27.11.18,26.11.18,,25.11.18,0,0,"180,000.00",1,2,1,,4,Niti-N,23.11.18,60 Ditë,,"31,842.43",0,,,,,,,,,,,,,,,,,,,,NaN,Drejtoria e Shërbimeve Publike,Shqipe Isufi
1,1,108,5,1,1,45,Ndërtimi i rrugës nga Flotacioni lagja Vakovc-Marevc ,15.08.18,25.08.18,28.08.18,07.09.18,,,16.10.18,43,10,,6,13.11.18,20.11.18,,12.11.18,0,0,"784,403.47",1,1,1,,4,"Grup i Operatorëve Ekonomik: N.T.P ""Bashkimi"", N.T. ""Rahovica Comerce"", Eko Group Sh.p.k",23.11.18,90 Ditë,,"572,778.14",15,,,,,,,,,,,,,,,,,,,,NaN,Drejtoria e Investimeve Kapitale dhe Menaxhim të Kontratave,Nexhmi Mekolli
1,1,110,5,2,1,45,Rregullimi i varrezave të dëshmorëve në Viti të Marecit-Prishtinë,26.07.17,22.03.18,29.08.18,06.09.18,,,26.09.18,34,6,,2,01.11.18,06.11.18,,30.10.18,0,0,"498,750.29",1,1,1,jo,4,"Grup i Operatorëve Ekonomik ""Gama Ing"" & ""Delta-Ing"" & ""Graniti Com""",13.11.18,90 Ditë,,"420,041.49",0,,,,,,,,,,,,,,,,,,,,NaN,Drejtoria e Investimeve Kapitale dhe Menaxhim të Kontratave,Nexhmi Mekolli
1,1,118,1,3,6,,Furnizimi me inventar për drejtorinë e pronës,25.09.18,25.09.18,07.10.18,10.10.18,,,19.10.18,0,3,,1,19.11.18,20.11.18,,14.11.18,0,0,"6,000.00",1,1,1,jo,4,A&F Construction,23.11.18,30 Ditë,,"5,830.70",1,,,,,,,,,,,,,,,,,,,,NaN,Drejtoria e Pronës,Nexhmi Mekolli
